{
  "schema_version": "canonical-trajectory-v1",
  "trace_id": "2788b0195d9fdd1c379d313d3f90408959a12f7d97564c3fedfa3804cd9e8ca6",
  "source": {
    "dataset_id": "frankengate/governed-conformance",
    "dataset_revision": "governed-v1",
    "adapter": "synthetic-governed-fixture-v1"
  },
  "task": {"task_id": "authorized-result-no-state-delta"},
  "events": [
    {
      "event_id": "e000",
      "sequence": 0,
      "kind": "tool_call_proposal",
      "observation_status": "observed",
      "source_role": "assistant",
      "content": "set_flag(feature-x, enabled)",
      "execution_status": "proposed"
    },
    {
      "event_id": "e001",
      "sequence": 1,
      "kind": "authorization_decision",
      "observation_status": "observed",
      "source_role": "governance",
      "content": "Allowed.",
      "parent_event_id": "e000",
      "decision": "allow",
      "authorization_epoch": 12
    },
    {
      "event_id": "e002",
      "sequence": 2,
      "kind": "tool_execution",
      "observation_status": "observed",
      "source_role": "tool",
      "content": "set_flag started",
      "parent_event_id": "e000",
      "proposal_event_id": "e000",
      "authorization_decision_event_id": "e001",
      "execution_id": "exec-001"
    },
    {
      "event_id": "e003",
      "sequence": 3,
      "kind": "tool_result",
      "observation_status": "observed",
      "source_role": "tool",
      "content": "{\"accepted\":true}",
      "parent_event_id": "e002",
      "execution_id": "exec-001"
    }
  ],
  "outcome": {
    "value": "result_observed_state_unverified",
    "source": "tool_result",
    "evidence_event_ids": ["e003"]
  },
  "loss_receipt": {
    "source_event_count": 4,
    "canonical_event_count": 4,
    "silently_dropped_event_count": 0,
    "reconstructed_fields": [],
    "known_missing_fields": ["observed_state_delta"],
    "expected_invariants": [
      {
        "type": "authorized_execution",
        "execution_event_id": "e002",
        "proposal_event_id": "e000",
        "decision_event_id": "e001"
      },
      {
        "type": "result_without_observed_state_delta",
        "result_event_id": "e003",
        "execution_event_id": "e002"
      }
    ],
    "expected_projection_losses": [
      {
        "target": "atif-v1.7",
        "feature": "result_vs_state_change",
        "disposition": "lost",
        "reason": "A tool result cannot prove that the external state changed."
      }
    ]
  }
}
